{
  "$schema": "https://raw.githubusercontent.com/dkharlanau/agent-ready-web-profile/main/schema/site-focus-profile-v0.3.schema.json",
  "version": "0.3",
  "canonicalUrl": "https://dkharlanau.github.io/agent-ready-web-profile/",
  "thesis": {
    "primaryProblem": "Website owners need to decide which Search, AI-search and agent-web improvements actually help a useful site become easier to find, use, cite and verify.",
    "primaryAudience": "Website owners and maintainers who can change a public site.",
    "usefulOutcome": "Choose a bounded evidence-backed improvement, implement it safely, verify the surface and measure the outcome separately.",
    "distinctEvidence": "Source-backed practices, explicit hypotheses, reproducible audits, Resolver observations, evidence receipts, experiments and dogfood on real sites.",
    "primaryAction": "Run a focused audit or choose the next evidence-backed change."
  },
  "scope": {
    "in": [
      "Search and AI-search discoverability decisions",
      "agent-web interoperability and machine-readable access",
      "content usefulness, evidence and citation support",
      "site-focus and information-architecture review",
      "verification, experiments and owner-side measurement"
    ],
    "adjacent": [
      "protocol reference material",
      "standards mapping",
      "benchmarks and research artifacts",
      "implementation templates and examples"
    ],
    "out": [
      "guaranteed rankings, citations or recommendations",
      "generic content-volume production",
      "opaque readiness or SEO scores",
      "a proprietary manifest intended to replace native web standards"
    ]
  },
  "problemLanes": [
    {
      "id": "be-found",
      "label": "Be found",
      "job": "Help people, crawlers and agents reach the useful surface.",
      "audience": "A site owner whose useful pages are difficult for Search, AI systems or agents to discover reliably.",
      "problem": "Useful site surfaces exist, but discovery, identity, routing or retrieval evidence is weak or ambiguous.",
      "desiredOutcome": "Make the right public surface easier to discover and retrieve without inventing artificial content volume.",
      "primaryAction": "Inspect discoverability and choose one evidence-backed discovery change."
    },
    {
      "id": "be-used",
      "label": "Be used",
      "job": "Make the answer clear, useful, attributable and machine-readable.",
      "audience": "A site owner whose pages are reachable but not sufficiently clear, attributable or useful once retrieved.",
      "problem": "A reachable page can still be hard to understand, cite, navigate or connect to the user's actual task.",
      "desiredOutcome": "Give each important page a clear job, useful evidence, explicit attribution and a bounded next action.",
      "primaryAction": "Review the page contract or select a usefulness pattern."
    },
    {
      "id": "be-proven",
      "label": "Be proven",
      "job": "Separate implementation checks from real outcome evidence.",
      "audience": "A maintainer who needs to know whether a website change was implemented correctly and whether it later helped.",
      "problem": "Technical completion is often mistaken for proof of ranking, citation, recommendation traffic or conversion impact.",
      "desiredOutcome": "Preserve implementation receipts and later Search, AI, runtime or owner outcomes as distinct evidence classes.",
      "primaryAction": "Verify the change and attach later measurement evidence separately."
    }
  ],
  "homepage": {
    "primaryLane": "be-found",
    "supportingLanes": ["be-used", "be-proven"],
    "requiredSignals": ["problem", "audience", "outcome", "evidence", "action"]
  },
  "primaryNavigation": [
    "/site-focus.html",
    "/discoverability.html",
    "/growth/",
    "/trust/"
  ],
  "routeRules": [
    { "match": { "path": "/" }, "role": "problem-commercial", "scope": "IN", "lane": "be-found", "note": "Primary product narrative and entry point." },
    { "match": { "path": "/site-focus.html" }, "role": "problem-commercial", "scope": "IN", "lane": "be-used", "note": "Problem-boundary and architecture gate." },
    { "match": { "path": "/discoverability.html" }, "role": "problem-commercial", "scope": "IN", "lane": "be-found", "note": "Evidence-backed practice selection." },
    { "match": { "pathPrefix": "/growth" }, "role": "proof-portfolio", "scope": "IN", "lane": "be-proven", "note": "Growth loop, hypotheses, experiments and outcome separation." },
    { "match": { "pathPrefix": "/trust" }, "role": "trust-utility", "scope": "IN", "lane": "be-proven", "note": "Evidence, claims and trust surfaces." },
    { "match": { "pathPrefix": "/research" }, "role": "proof-portfolio", "scope": "ADJACENT", "lane": "be-proven", "note": "Research depth supports the product thesis without becoming a separate homepage identity." },
    { "match": { "pathPrefix": "/benchmark" }, "role": "proof-portfolio", "scope": "ADJACENT", "lane": "be-proven", "note": "Benchmark evidence is supporting proof." },
    { "match": { "pathPrefix": "/resolver" }, "role": "technical-reference", "scope": "ADJACENT", "lane": "be-found", "note": "Technical interoperability implementation surface." },
    { "match": { "pathPrefix": "/standards" }, "role": "technical-reference", "scope": "ADJACENT", "lane": "be-found", "note": "Reference depth, not a first-order product lane." },
    { "match": { "pathPrefix": "/directory" }, "role": "technical-reference", "scope": "ADJACENT", "lane": "be-found", "note": "Reference/directory surface." },
    { "match": { "pathPrefix": "/skills" }, "role": "technical-reference", "scope": "ADJACENT", "lane": "be-used", "note": "Agent-facing implementation guidance." },
    { "match": { "pathPrefix": "/examples" }, "role": "proof-portfolio", "scope": "ADJACENT", "lane": "be-used", "note": "Examples are proof/supporting material." }
  ],
  "experience": {
    "visualPrinciples": [
      "Bright high-contrast identity without decorative clutter.",
      "Strong typographic hierarchy with evidence-led diagrams and visible state changes.",
      "A simple first screen with technical depth progressively disclosed underneath.",
      "Motion only when it explains state, causality or progression rather than decorating the page."
    ],
    "navigation": {
      "maxPrimaryItems": 5,
      "consistentAcrossPages": true
    },
    "performance": {
      "lcpMsP75Max": 2500,
      "inpMsP75Max": 200,
      "clsP75Max": 0.1
    }
  },
  "notes": [
    "The four internal navigation destinations are the declared contract; the external GitHub link may remain a utility action without becoming another problem lane.",
    "Route families are implementation architecture, not a proxy for the number of problems the site owns.",
    "Visual principles are owner intent, not a beauty score. Performance budgets require real field evidence and are not inferred from static HTML."
  ]
}
